,title,url
1,The Ultimate Guide to SEM (Search Engine Marketing),https://blog.hubspot.com
2,Search Engine Marketing (SEM): How to Do It Right,https://www.wordstream.com
3,Search engine marketing - Optimizely,https://www.optimizely.com
4,What Is Search Engine Marketing & How Does It Work?,https://www.semrush.com
5,Search engine marketing - Wikipedia,https://en.wikipedia.org
6,SEO vs SEM: How Do They Work Together,https://digitalmarketinginstitute.com
7,What Is Search Engine Marketing? Definition and Basic ...,https://www.cyberclick.net
8,"What Is SEM? Definition, Advantages, Disadvantages, and ...",https://www.cyberclick.net
9,SEO vs. SEM: What's The Difference? - Backlinko,https://backlinko.com
10,What Is SEM? A Guide to Paid Search Engine Marketing,https://www.deskera.com
11,Your Preferred SEM Agency - OOm Singapore,https://www.oom.com.sg
12,The Ultimate Guide To Search Engine Marketing (SEM) In 2022,https://www.forbes.com
13,Search Engine Marketing (SEM): When and How to Use It,https://www.shopify.com
14,What is search engine marketing? | Adobe Glossary,https://business.adobe.com
15,SEM vs. SEO: What's The Difference? - Search Engine Journal,https://www.searchenginejournal.com
16,6 SEM Best Practices Growth Marketers Need To Master,https://www.searchenginejournal.com
17,Digital Marketing - Search Engine Marketing | SMU Academy,https://academy.smu.edu.sg
18,Up To 70% Off SEM (PPC) Services - PSG Pre-Approved ...,https://www.impossible.sg
19,search engine marketing (SEM) - TechTarget,https://www.techtarget.com
20,Search Engine Marketing - SEM Services Singapore,https://www.w360.asia
21,"SEO or SEM? – Examples, Differences, Pros & Cons ...",https://www.equinetacademy.com
22,What is SEM in Marketing? Best SEM Strategies & Practices in ...,https://ppcexpo.com
23,SEO vs. SEM: What's the Difference? - Ahrefs,https://ahrefs.com
24,What is SEM? What is PPC? A complete guide to paid search ...,https://searchengineland.com
25,SEM Agency in Singapore - Aii Develop,https://www.aiidevelop.com.sg
26,SEM Agency | Up To 70% Grant For SEM Services | MediaOne,https://mediaonemarketing.com.sg
27,SEM vs. SEO: Comparing Two Key Marketing Terms,https://online.maryville.edu
28,Search Engine Marketing (SEM) - Content Marketing Glossary,https://www.clickworker.com
29,Search Engine Marketing: What is SEM & How it relates to SEO,https://rockcontent.com
30,What is Search Engine Marketing (SEM)? - Reliablesoft,https://www.reliablesoft.net
31,What is search engine marketing? - Microsoft Advertising,https://about.ads.microsoft.com
32,Established SEM Agency in Singapore | PurpleClick Media,https://www.purpleclick.com
33,Why Is Search Engine Marketing (SEM) Important? - IH Digital,https://www.ihdigital.com
34,A Complete Guide to Search Engine Marketing (SEM),https://careerfoundry.com
35,SEM Fundamentals: Search Engine Marketing Strategy,https://www.rootsdigital.com.sg
36,Paid Search Engine Marketing (SEM) (New) - TaF.tc,https://www.taftc.org
37,The Benefits of Search Engine Marketing | Why SEM is Important,https://raddinteractive.com
38,Search Engine Marketing (SEM) Services :: tinkerEdge,https://www.tinkeredge.com
39,What Is an SEM Campaign? (Plus 7 Tips for Launching Yours),https://www.webfx.com
40,What is SEM? - PPC & Paid Search Engine Marketing Explained,https://intellipaat.com
41,Search Engine Marketing (SEM) Services - Verz Design,https://www.verzdesign.com
42,Search Engine Marketing (SEM) | Help Center | Wix.com,https://support.wix.com
43,What Is SEM? Your Guide to Search Engine Marketing,https://www.wix.com
44,Search engine marketing statistics 2022 | Smart Insights,https://www.smartinsights.com
45,SEM : a Promising Marketing Technique for Your Business,https://www.hashmicro.com
46,Understanding Search Marketing SEO Vs SEM - Getfused,https://www.getfused.com
47,"Search Engine Marketing (SEM) Market Scope, Forecast by ...",https://www.transparencymarketresearch.com
48,What is SEM (Search Engine Marketing)? - BigCommerce,https://www.bigcommerce.com
49,SEM Services Singapore | SEM Agency - First Page,https://www.firstpage.asia
50,Intro to Search Engine Marketing (SEM) - CleverlySG,https://cleverly.sg
51,Search Engine Marketing (SEM) Online Training Courses,https://www.linkedin.com
52,What is SEM? And How It Benefits Your Business Marketing,https://www.lyfemarketing.com
53,Search Engine Marketing 101: An Effective Growth Strategy,https://algorithmicglobal.com
54,Search Engine Marketing (SEM): What Is It and Why Is It ...,https://www.oberlo.com
55,SEO vs SEM in Digital Marketing - Tribute Media,https://www.tributemedia.com
56,SEM Guide: What are your Search Engine Marketing Goals?,https://landerapp.com
57,"Google Ads, PPC & SEM Services Singapore | Fenzo Digital",https://fenzodigital.com
58,Best Search Engine Marketing (SEM) Tools 2022 - TrustRadius,https://www.trustradius.com
59,"Search Engine Marketing (SEM) in Singapore, PPC Services ...",https://ocdigitalnetwork.com
60,Top 12 Strategies of Search engine - Marketing - eduCBA,https://www.educba.com
61,SEO and SEM in Digital Marketing: Advantages of Each ...,https://digitalagencynetwork.com
62,Search Engine Marketing - Tutorialspoint,https://www.tutorialspoint.com
63,WSQ Search Engine Marketing,https://www.wfa.sg
64,What is Search Engine Marketing: Guide - SendPulse,https://sendpulse.com
65,Search Engine Marketing Management Singapore |,https://aapc.com.sg
66,The Power of Search Engine Marketing (SEM) - Freshworks,https://www.freshworks.com
67,SEM Marketing - Top Floor,https://www.topfloortech.com
68,Search Engine Marketing (SEM & PPC) - Merkle,https://www.merkleinc.com
69,SEM Services in Singapore - Search Engine Marketing ...,https://mapletreemedia.com
70,7 Search Engine Marketing Best Practices for 2021 - Instapage,https://instapage.com
71,High-ROI SEM Agency in Singapore - Mediaplus Digital Pte Ltd,https://mediaplus.com.sg
72,SEM - Data Driven Marketing,https://semtr.com
73,Search Engine Marketing (SEM) – World leaders in digital ...,https://www.inventiva.global
74,In Search of Search Engine Marketing Strategy Amongst ...,https://link.springer.com
75,"Search Engine Marketing Services (SEM) - Thryv, Inc.",https://corporate.thryv.com
76,Sky-rocket your ROI with SEM Services | Top SEM Agency,https://www.uplers.com
77,Best Search Engine Marketing (SEM) Agencies in 2022 - G2,https://www.g2.com
78,3 Strategies to Drive Search Engine Marketing Success - Act-On,https://act-on.com
79,What is Search Engine Marketing (SEM)? - Directive Consulting,https://directiveconsulting.com
80,What is Search Engine Marketing (SEM)?,https://ecommerce-platforms.com
81,Search Engine Marketing (SEM) - Activa Media,https://www.activamedia.com.sg
82,Search Engine Marketing (SEM) Specialist job description,https://resources.workable.com
83,Search Engine Marketing (SEM) FAQ | Anvil Media Inc.,https://www.anvilmediainc.com
84,A Brief History of Search Engine Marketing - Basis Technologies,https://basis.net
85,Performance based SEM services by a Google Partner,https://icecube.asia
86,The 10 Best Search Engine Marketing (SEM) Tools for 2022,https://compose.ly
87,What is Search Engine Marketing? | Find Out About SEM,https://leadgenera.com
88,What Does Search Engine Marketing (SEM) Mean? - Bruce Clay,https://www.bruceclay.com
89,Search Engine Marketing Agency for Startups - KPI Media,https://www.kpimedia.sg
90,Top 7 Best SEM Tools For Search Engine Marketing In 2022,https://www.softwaretestinghelp.com
91,Search Engine Marketing (SEM): #1 Step-by-Step Tutorial,https://www.udemy.com
92,Top 11 Benefits of Search Engine Marketing in 2022 - IIDE,https://iide.co
93,Search Engine Marketing (SEM) in 2022: The Ultimate Guide,https://www.thehoth.com
94,Free Search Engine Marketing Course for Beginners,https://www.mygreatlearning.com
95,Top SEO and SEM Marketing Strategies For Your Business,https://www.campaignmonitor.com
96,Search Engine Marketing Course (SEM) - FirstCom Academy,https://www.fcacademy.com.sg
97,SEM Best Practices & Why You Need to Follow Them,https://www.benchmarkone.com
98,SEO and SEM – Which Is More Important?,https://growthmarketinggenie.com
99,Search Engine Marketing (SEM) 101 Part 1 - MoreVisibility,https://www.morevisibility.com
