,title,url
1,All You Need To Know About Productivity Solutions Grant (PSG),https://www.oom.com.sg
2,PSG Pre-Approved Grant - Digital Marketing up to 70% off,https://www.impossible.sg
3,PSG Digital Marketing Grant Vendor | Get Up To 70% Off,https://mediaonemarketing.com.sg
4,PSG Accelerated Digital Marketing Package,https://www.nextlevel.sg
5,Activate Your Digital Marketing With PSG 70% Budget Support,https://mediaplus.com.sg
6,Productivity Solutions Grant (PSG) - Enterprise Singapore,https://www.enterprisesg.gov.sg
7,Start your digital transformation journey with the Productivity ...,https://www.gobusiness.gov.sg
8,4 Best PSG Pre Approved Digital Marketing Services In SG,https://it.com.sg
9,Save Up To 70% On Your Digital Marketing With PSG Grant,https://www.rootsdigital.com.sg
10,PSG Digital Marketing Grant - Ice Cube,https://icecube.asia
11,PSG Digital Marketing SEM SEO SM Grant - Cleverly SG,https://cleverly.sg
12,PSG E-Commerce Solution - CleverlySG,https://cleverly.sg
13,PSG Marketing Solutions - LinkedIn,https://www.linkedin.com
14,Productivity Solutions Grant (PSG) - FirstCom Solutions,https://www.firstcom.com.sg
15,Productivity Solutions Grant (PSG) - I Concept Digital,https://iconceptdigital.com
16,Kick-start digital marketing with pre-approved PSG vendor ...,https://www.media-outreach.com
17,Impossible Marketing is now a PSG ... - Yahoo News Singapore,https://sg.news.yahoo.com
18,PSG Grant Singapore - Claim up to 70% - SHOPLINE,https://marketing.shopline.sg
19,How Paris Saint-Germain became one of the most desirable ...,https://www.luxurytribune.com
20,Pre-Approval of ICM Vendors' Solutions,https://www.imda.gov.sg
21,"SENIOR EXECUTIVE / EXECUTIVE, SALES & MARKETING ...",https://www.mycareersfuture.gov.sg
22,SMEs can tap funds for digital marketing with expansion of ...,https://www.straitstimes.com
23,PSG Media Solutions: RI Web Design & Digital Marketing ...,https://psgmedia.co
24,How PSG has leaned on content creation to become the ...,https://www.hashtagsports.com
25,Singapore PSG Pre Approved Vendor - Verz Design,https://www.verzdesign.com
26,PSG Pre-Approved Digital Marketing Grant Singapore,https://www.apecsolutions.com
27,Hubspot PSG Grant I Brew Interactive,https://brewinteractive.com
28,Inside PSG's Grand Plan to Become the World's Coolest ...,https://musebycl.io
29,"senior executive/executive, sales & marketing (psg-jr team)",https://www.glassdoor.sg
30,Marketing - PSG Hospitals,https://psgimsr.ac.in
31,Kick-start digital marketing with pre-approved PSG vendor ...,https://www.moneyfm893.sg
32,OOm Appointed As A Pre-Approved Digital Marketing ...,https://en.prnasia.com
33,PSG MARKETING & TRADING (53085625E) - Companies.sg,https://www.companies.sg
34,Digital Marketing Agency in Singapore - Corsiva Lab,https://www.corsivalab.com
35,"Sr. Manager, Market Development, PSG job in Remote / Field ...",https://jobs.thermofisher.com
36,"Engage PSG Global Specialists In Sales, Marketing And ...",https://www.engagepsg.com
37,CARNAVAL PSG | Samba Digital Sports Marketing Agency,https://sambadigital.com
38,Impossible Marketing is one of first PSG pre-approved vendor ...,https://www.thejournalist.sg
39,MediaOne Accredited as Pre-Approved Productivity Solutions ...,https://www.einnews.com
40,PSG Digital Marketing Grant Solution - Tomorrow Grp,https://tomorrowgrp.com
41,Productivity Solutions Grant (PSG) - Singapore - Venuerific,https://www.venuerific.com
42,4 Best PSG Pre-Approved Digital Marketing Services,https://www.marchh.com
43,The 4 Best PSG Pre Approved Digital Marketing Agencies In SG,https://sgneighbourhood.com
44,eCommerce Design and Development - Up to 80% PSG ...,https://i-concept.com.sg
45,"PSG Life Sciences | Sales, Marketing, Business Development ...",https://www.psglifesciences.com
46,PSG digital marketing grant – Insider Insights - BRDGE,https://www.brdge.tech
47,OOm Pte Ltd - New PSG For Digital Marketing Solutions,https://m.facebook.com
48,0:06,Marketing Productivity Solution Grant (PSG)! This ... Find out more about Digital Marketing PSG here: https:
49,Sports marketing: the PSG's Advent calendar - Qualifio,https://qualifio.com
50,Join us for the PSG Digital Marketing Programme with up to 70 ...,https://www.youtube.com
51,"Siavoush Fallahi on Twitter: ""PSG's marketing director about ...",https://twitter.com
52,Job Description - Monster Singapore,https://www.monster.com.sg
53,Create Job Alert. - Jobscentral,https://jobscentral.com.sg
54,SG Pre-Approved PSG eCommerce Development Agency ...,https://alphasixmarketing.com.sg
55,PSG Grant - RHAD Agency,https://rhad.agency
56,"senior executive/executive, sales & marketing (psg-jr team)",https://sg.talent.com
57,PSG Pre-Approved: The 4 Best Digital Marketing Agency In SG,https://localguide.co
58,Marketing Toolkit - PSG Conference 2021,https://psgconference.com
59,Expert Digital Marketing & Advertising Services - 360 PSG,https://www.360psg.com
60,FDJ scores partnership with Paris-Saint-Germain,https://igamingbusiness.com
61,PSG | Sparx Publishing Group,https://www.sparxpg.com
62,PSG - Nekya | Digital Marketing Agency,https://nekya.com
63,Step-by-Step Guide for PSG Claim via the Business Grants ...,https://361dc.com
64,Digital Marketing: The 4 Best PSG Pre Approved Agencies,https://nearme.com.sg
65,[2022] PSG Marketing Segmentation Targeting Differentiation ...,https://embapro.com
66,Creative & Marketing (36 Jobs) - Professional Staffing Group,https://www.psgstaffing.com
67,"Cavani : L'Optimum | Paris saint-germain, Sports marketing, Psg",https://www.pinterest.com.mx
68,How can Singapore SMEs access PSG funding for technology?,https://www.salesforce.com
69,Word of mouth will always be your best Marketing tool,https://psgsipp.co.uk
70,A Quick Guide on the PSG Digital Marketing Grant - Vingle,https://www.vingle.net
71,PSG MARKETING & TRADING (53085625E) - Singapore Entity,https://www.sgpbusiness.com
72,CAD Singapore: Business Software | PSG Pre-Approved,https://cad.sg
73,Complete list of Productivity Solutions Grant (PSG ... - The Grid,https://sgpgrid.com
74,PSG MARKETING LTD overview - Companies House - GOV.UK,https://find-and-update.company-information.service.gov.uk
75,Kick-start digital marketing with pre-approved PSG vendor ...,http://bizhub.vn
76,e-Commerce website development with PSG up to 70% Grant ...,https://www.orfeostory.com
77,Inside the deal: PSG and Fanatics' landmark ecommerce ...,https://www.sportspromedia.com
78,Certified Digital Marketing Master Course,https://www.psgtech.edu
79,"Psg Marketing Solutions Jobs, Employment | Indeed.com",https://www.indeed.com
80,"""La force du PSG, c'est la cohérence affichée dans sa ...",https://www.ecofoot.fr
81,PSG Grant Pre-approved Temperature Screening Solution,https://vuetechsg.com
82,PSG Life Sciences Agency Services & Qualifications | HubSpot,https://ecosystem.hubspot.com
83,Strategic Advisory | MOJO PSG - A marketing operating ...,https://mojopsg.com
84,Marketing. Psg - Quora,https://www.quora.com
85,Neymar marketing move threatens PSG and Nike - AS USA,https://en.as.com
86,What You Need To Know About Digital Marketing Grants In ...,https://mapletreemedia.com
87,"PSG Marketing, Author at Pattison Sign Group",https://pattisonsign.com
88,Messi: PSG president says world will be 'shocked' by revenues,https://www.cnbc.com
89,Ms Psg Marketing - Seed Retailers in Cholakkadai Street,https://www.justdial.com
90,Reaching in strategy via the PSG email marketing. Source,https://www.researchgate.net
91,4 Best PSG Approved Agencies For Digital Marketing Needs,https://supportlocal.com.sg
92,PSG marketing director explains Lionel Messi's impact on ...,https://m.allfootballapp.com
93,How to leverage social media to promote your offline ... - WePlay,https://weplay.co
94,PSG-Backed Imaweb Expands European Footprint Into the ...,https://www.businesswire.com
95,Impossible Marketing Is Now A PSG A Pre ... - Techspace Africa,https://tech-space.africa
96,PSG's smart strategy is the lastest in football's attempt to woo ...,https://digitalsport.co
97,The marketing power of a brand | PSG – Real Madrid,https://psgrealmadrid.wordpress.com
98,Paris Saint Germain Website Redesign,https://weareinfrared.com
99,"""The Used Jersey"" PSG's original sports marketing action",https://en.esloganmagazine.com
100,PSG added to Tecate's portfolio - Gilt Edge Soccer Marketing,https://www.giltedgesoccer.com
101,How to Apply for Productivity Solutions Grant | SME Funding ...,https://scaleupmarketing.asia
